{
  "schema_version": "1.0.0",
  "catalog_version": "seed-001-images",
  "locale": "vi-VN",
  "currency": "VND",
  "updated_at": "2026-10-10T01:30:00+07:00",
  "categories": [
    {
      "id": "gom-su",
      "name_vi": "Gốm sứ",
      "parent_id": null,
      "aliases": [
        "gốm",
        "sứ",
        "đồ gốm"
      ]
    },
    {
      "id": "gom-su-binh-lo",
      "name_vi": "Bình, lọ",
      "parent_id": "gom-su",
      "aliases": [
        "bình hoa",
        "lọ hoa",
        "bình cắm hoa"
      ]
    },
    {
      "id": "gom-su-bat-dia",
      "name_vi": "Bát, đĩa, chén ăn",
      "parent_id": "gom-su",
      "aliases": [
        "bát",
        "đĩa",
        "dĩa",
        "chén cơm"
      ]
    },
    {
      "id": "gom-su-am-chen",
      "name_vi": "Ấm chén, bộ trà",
      "parent_id": "gom-su",
      "aliases": [
        "ấm trà",
        "bộ ấm chén",
        "bình trà"
      ]
    },
    {
      "id": "gom-su-coc-ly",
      "name_vi": "Cốc, ly",
      "parent_id": "gom-su",
      "aliases": [
        "cốc",
        "ly",
        "tách",
        "cốc sứ"
      ]
    },
    {
      "id": "may-tre-coi",
      "name_vi": "Mây tre đan, cói",
      "parent_id": null,
      "aliases": [
        "mây tre",
        "đồ đan",
        "cói",
        "lục bình"
      ]
    },
    {
      "id": "may-tre-coi-gio",
      "name_vi": "Giỏ, rổ, khay đan",
      "parent_id": "may-tre-coi",
      "aliases": [
        "giỏ",
        "rổ",
        "khay",
        "làn"
      ]
    },
    {
      "id": "may-tre-coi-tui",
      "name_vi": "Túi đan",
      "parent_id": "may-tre-coi",
      "aliases": [
        "túi cói",
        "túi mây",
        "túi đan"
      ]
    },
    {
      "id": "may-tre-coi-noi-that",
      "name_vi": "Đồ nội thất, đèn đan",
      "parent_id": "may-tre-coi",
      "aliases": [
        "chụp đèn",
        "ghế mây"
      ]
    },
    {
      "id": "det-may",
      "name_vi": "Dệt may và phụ kiện truyền thống",
      "parent_id": null,
      "aliases": [
        "dệt may",
        "vải",
        "thổ cẩm"
      ]
    },
    {
      "id": "det-may-vai-lua",
      "name_vi": "Lụa, vải",
      "parent_id": "det-may",
      "aliases": [
        "lụa",
        "vải lanh",
        "vải thổ cẩm"
      ]
    },
    {
      "id": "det-may-khan",
      "name_vi": "Khăn",
      "parent_id": "det-may",
      "aliases": [
        "khăn lụa",
        "khăn choàng"
      ]
    },
    {
      "id": "det-may-thoi-trang",
      "name_vi": "Trang phục, phụ kiện",
      "parent_id": "det-may",
      "aliases": [
        "áo dài",
        "nón lá",
        "ví"
      ]
    },
    {
      "id": "go-son-mai",
      "name_vi": "Đồ gỗ, sơn mài, trang trí thủ công",
      "parent_id": null,
      "aliases": [
        "đồ gỗ",
        "sơn mài",
        "đồ trang trí"
      ]
    },
    {
      "id": "go-son-mai-son-mai",
      "name_vi": "Sơn mài",
      "parent_id": "go-son-mai",
      "aliases": [
        "hộp sơn mài",
        "tranh sơn mài",
        "khay sơn mài"
      ]
    },
    {
      "id": "go-son-mai-do-go",
      "name_vi": "Đồ gỗ",
      "parent_id": "go-son-mai",
      "aliases": [
        "đồ gỗ mỹ nghệ",
        "tượng gỗ"
      ]
    },
    {
      "id": "go-son-mai-tranh",
      "name_vi": "Tranh, đồ trang trí",
      "parent_id": "go-son-mai",
      "aliases": [
        "tranh Đông Hồ",
        "tranh dân gian"
      ]
    },
    {
      "id": "thuc-pham",
      "name_vi": "Thực phẩm đóng gói, đặc sản",
      "parent_id": null,
      "aliases": [
        "đặc sản",
        "đồ ăn",
        "thực phẩm"
      ]
    },
    {
      "id": "thuc-pham-tra",
      "name_vi": "Trà",
      "parent_id": "thuc-pham",
      "aliases": [
        "chè",
        "trà xanh",
        "chè búp"
      ]
    },
    {
      "id": "thuc-pham-ca-phe",
      "name_vi": "Cà phê",
      "parent_id": "thuc-pham",
      "aliases": [
        "cafe",
        "cà phê hạt",
        "cà phê bột"
      ]
    },
    {
      "id": "thuc-pham-banh-keo",
      "name_vi": "Bánh kẹo",
      "parent_id": "thuc-pham",
      "aliases": [
        "bánh",
        "kẹo",
        "mứt"
      ]
    },
    {
      "id": "thuc-pham-gia-vi",
      "name_vi": "Gia vị, nước chấm",
      "parent_id": "thuc-pham",
      "aliases": [
        "nước mắm",
        "tiêu",
        "muối"
      ]
    }
  ],
  "brands": [
    {
      "aliases": [],
      "id": "brand-minh-long",
      "name": "Minh Long",
      "official_url": "https://minhlong.com/",
      "origin_country": "VN",
      "origin_source_ids": [
        "src-minhlong-ve-chung-toi"
      ],
      "source_ids": [
        "src-minhlong-ve-chung-toi"
      ]
    },
    {
      "aliases": [],
      "id": "brand-lys",
      "name": "LY'S",
      "official_url": "https://minhlong.com/pages/thuong-hieu-lys",
      "origin_country": null,
      "source_ids": [
        "src-minhlong-thuong-hieu-lys"
      ]
    },
    {
      "aliases": [
        {
          "value": "Marou Faiseurs de Chocolat",
          "source_ids": [
            "src-marou-our-chocolate"
          ]
        },
        {
          "value": "Maison Marou",
          "source_ids": [
            "src-marou-our-chocolate"
          ]
        }
      ],
      "id": "brand-marou",
      "name": "Marou",
      "official_url": "https://maisonmarou.com/",
      "origin_country": null,
      "source_ids": [
        "src-marou-our-chocolate"
      ]
    },
    {
      "aliases": [],
      "id": "brand-hanoia",
      "name": "Hanoia",
      "official_url": "https://hanoia.com/",
      "origin_country": "VN",
      "origin_source_ids": [
        "src-hanoia-our-story"
      ],
      "place_ids": [
        "place-binh-duong"
      ],
      "source_ids": [
        "src-hanoia-our-story"
      ]
    },
    {
      "aliases": [
        {
          "value": "Kilomet 109",
          "source_ids": [
            "src-kilomet109-about"
          ]
        }
      ],
      "id": "brand-kilomet109",
      "name": "Kilomet109",
      "official_url": "https://www.kilomet109.com/",
      "origin_country": null,
      "source_ids": [
        "src-kilomet109-about"
      ]
    }
  ],
  "makers": [
    {
      "aliases": [],
      "id": "maker-minh-long-i",
      "name": "Công ty TNHH Minh Long I",
      "maker_type": "company",
      "brand_ids": [
        "brand-minh-long",
        "brand-lys"
      ],
      "official_url": "https://minhlong.com/",
      "source_ids": [
        "src-minhlong-trang-chu"
      ]
    },
    {
      "aliases": [],
      "id": "maker-vietnam-handicraft",
      "name": "Vietnam Handicraft Co., Ltd.",
      "maker_type": "company",
      "official_url": "https://vietcraft.vn/",
      "source_ids": [
        "src-vietcraft-about"
      ]
    }
  ],
  "places": [
    {
      "id": "place-ben-tre",
      "place_type": "province",
      "name_as_sourced": "Ben Tre province",
      "name_normalized": "Bến Tre",
      "aliases": [
        "ben tre"
      ],
      "source_ids": [
        "src-marou-ben-tre-78-80g"
      ],
      "parent_id": null,
      "admin_code": null,
      "admin_code_scheme": null,
      "verified_at": null
    },
    {
      "id": "place-tien-giang",
      "place_type": "province",
      "name_as_sourced": "Tien Giang province",
      "name_normalized": "Tiền Giang",
      "aliases": [
        "tien giang"
      ],
      "source_ids": [
        "src-marou-quat-tien-giang-68-80g",
        "src-marou-our-chocolate"
      ],
      "parent_id": null,
      "admin_code": null,
      "admin_code_scheme": null,
      "verified_at": null
    },
    {
      "id": "place-lam-dong",
      "place_type": "province",
      "name_as_sourced": "Lam Dong",
      "name_normalized": "Lâm Đồng",
      "aliases": [
        "lam dong"
      ],
      "source_ids": [
        "src-marou-our-chocolate"
      ],
      "parent_id": null,
      "admin_code": null,
      "admin_code_scheme": null,
      "verified_at": null
    },
    {
      "id": "place-ba-ria",
      "place_type": "province",
      "name_as_sourced": "province of Ba Ria",
      "name_normalized": "Bà Rịa",
      "aliases": [
        "ba ria"
      ],
      "source_ids": [
        "src-marou-ba-ria-76-80g"
      ],
      "parent_id": null,
      "admin_code": null,
      "admin_code_scheme": null,
      "verified_at": null
    },
    {
      "id": "place-ha-noi",
      "place_type": "province",
      "name_as_sourced": "Hanoi",
      "name_normalized": "Hà Nội",
      "aliases": [
        "ha noi",
        "hanoi"
      ],
      "source_ids": [
        "src-kilomet109-about"
      ],
      "parent_id": null,
      "admin_code": null,
      "admin_code_scheme": null,
      "verified_at": null
    },
    {
      "id": "place-binh-duong",
      "place_type": "province",
      "name_as_sourced": "tỉnh Bình Dương",
      "name_normalized": "Bình Dương",
      "aliases": [
        "binh duong"
      ],
      "source_ids": [
        "src-hanoia-our-story"
      ],
      "parent_id": null,
      "admin_code": null,
      "admin_code_scheme": null,
      "verified_at": null
    }
  ],
  "sources": [
    {
      "id": "src-minhlong-ve-chung-toi",
      "url": "https://minhlong.com/pages/ve-chung-toi",
      "title": "Về chúng tôi — Gốm sứ Minh Long",
      "publisher": "Công ty TNHH Minh Long I",
      "source_type": "official_brand",
      "retrieved_at": "2026-10-10T00:18:00+07:00",
      "usage_rights_note": "Chỉ dùng làm căn cứ thông tin; không sao chép nội dung.",
      "supports": [
        "vn_brand"
      ]
    },
    {
      "id": "src-minhlong-trang-chu",
      "url": "https://minhlong.com/",
      "title": "Trang chủ Gốm sứ Minh Long (footer: trụ sở chính)",
      "publisher": "Công ty TNHH Minh Long I",
      "source_type": "official_brand",
      "retrieved_at": "2026-10-10T00:18:00+07:00",
      "usage_rights_note": "Chỉ dùng làm căn cứ thông tin; không sao chép nội dung.",
      "supports": [
        "maker"
      ]
    },
    {